### ISSUE TITLE
5s timeout not working quite as expected (anymore)

### ISSUE THREAD

**Issue by vanniktech** [pinae/dashbutton#1]
First of all thanks for the cool article. I just received two dash buttons today and tried directly the python script.

As far as I can tell the button is sending the ARP request periodically and multiple times in a pattern of 3 requests in a batch (each one second after another). After that it waits for some time and tries again sending 3 requests in a batch and does this endlessly.

Could it be that I got a newer version of the dash button where they included this 'fix' to prevent anyone from using the button for a different purpose other than ordering from amazon?

I also still didn't select the product hence I get the notification 'You're almost done ..' on my phone although this one I get only the first time so it seems like the Amazon Server is able to handle this somehow.

**Comment by pinae** [comment]
That sounds quite different to the behaviour we observed. When did you order your button and for which brand?

It sounds weird to me that the button sends more requests after some time. Since it's battery-powered it should conserve as much energy as possible. Sending useless ARP-requests is clearly wasting power. Especially if the button stays powered up for a longer time.

**Comment by vanniktech** [comment]
I ordered two buttons (Persil & Somat) on the 23rd October. I only tested it with the Somat button so far. I can try the Persil one later.

Yeah it also does not make much sense to me that multiple ARP requests are sent.

**Comment by pinae** [comment]
We just ordered a Persil Button. We will test if Amazon really did change the firmware in order to prevent the hack. Thanks for the info.

**Comment by vanniktech** [comment]
Oh that's cool. I'll also test the other button and report back.

**Comment by dl8bb** [comment]
Hi folks, I've got my 3 dash buttons at the beginning of the week any they do what I excpet. 

Here is a short tcpdump from one button press on the Wilkinson dash button:

```
$ sudo tcpdump -i ap0
tcpdump: verbose output suppressed, use -v or -vv for full protocol decode
listening on ap0, link-type EN10MB (Ethernet), capture size 262144 bytes
13:06:02.142094 50:f5:da:aa:bb:cc (oui Unknown) > Broadcast Null Unnumbered, xid, Flags [Response], length 6: 01 00
13:06:02.148479 EAPOL key (3) v2, len 95
13:06:02.154069 EAPOL key (3) v2, len 117
13:06:02.155971 EAPOL key (3) v2, len 151
13:06:02.167606 EAPOL key (3) v2, len 95
13:06:02.171986 IP 0.0.0.0.bootpc > 255.255.255.255.bootps: BOOTP/DHCP, Request from 50:f5:da:aa:bb:cc (oui Unknown), length 261
13:06:02.172135 IP 0.0.0.0.bootpc > 255.255.255.255.bootps: BOOTP/DHCP, Request from 50:f5:da:aa:bb:cc (oui Unknown), length 261
13:06:02.244126 IP dashpi.dash.button.net.bootps > wilkinson.dash.button.net.bootpc: BOOTP/DHCP, Reply, length 300
13:06:02.246166 ARP, Request who-has dashpi.dash.button.net tell wilkinson.dash.button.net, length 28
13:06:02.246333 ARP, Reply dashpi.dash.button.net is-at 98:de:d0:aa:bb:dd (oui Unknown), length 28
13:06:02.246463 ARP, Request who-has dashpi.dash.button.net tell wilkinson.dash.button.net, length 28
13:06:02.248257 IP wilkinson.dash.button.net.59149 > dashpi.dash.button.net.domain: 32061+ A? time-c.nist.gov. (33)
13:06:02.248889 IP dashpi.dash.button.net.domain > wilkinson.dash.button.net.59149: 32061* 1/0/0 A 192.168.X.Y (49)
13:06:02.250228 IP wilkinson.dash.button.net.59150 > dashpi.dash.button.net.ntp: NTPv4, Client, length 48
13:06:02.250781 IP dashpi.dash.button.net.ntp > wilkinson.dash.button.net.59150: NTPv4, Server, length 48
13:06:02.255777 IP wilkinson.dash.button.net.59149 > dashpi.dash.button.net.domain: 46994+ A? parker-gw-eu.amazon.com. (41)
13:06:02.256821 IP dashpi.dash.button.net.domain > wilkinson.dash.button.net.59149: 46994* 1/0/0 A 192.168.X.Y (57)
13:06:02.258899 IP wilkinson.dash.button.net.59151 > dashpi.dash.button.net.https: Flags [S], seq 4079072737, win 4338, options [mss 1446], length 0
13:06:02.259030 IP dashpi.dash.button.net.https > wilkinson.dash.button.net.59151: Flags [R.], seq 0, ack 4079072738, win 0, length 0
13:06:02.281102 IP wilkinson.dash.button.net.59149 > dashpi.dash.button.net.domain: 19769+ A? parker-gw-eu.amazon.com. (41)
13:06:02.281593 IP dashpi.dash.button.net.domain > wilkinson.dash.button.net.59149: 19769* 1/0/0 A 192.168.X.Y (57)
13:06:02.284591 IP wilkinson.dash.button.net.59152 > dashpi.dash.button.net.https: Flags [S], seq 4079072738, win 4338, options [mss 1446], length 0
13:06:02.284717 IP dashpi.dash.button.net.https > wilkinson.dash.button.net.59152: Flags [R.], seq 0, ack 4079072739, win 0, length 0
13:06:07.257811 ARP, Request who-has wilkinson.dash.button.net tell dashpi.dash.button.net, length 28
13:06:08.257795 ARP, Request who-has wilkinson.dash.button.net tell dashpi.dash.button.net, length 28
13:06:09.257799 ARP, Request who-has wilkinson.dash.button.net tell dashpi.dash.button.net, length 28
13:06:19.238787 IP 0.0.0.0.bootpc > 255.255.255.255.bootps: BOOTP/DHCP, Request from 98:de:d0:aa:bb:dd (oui Unknown), length 332
13:06:24.997525 IP dashpi.dash.button.net.ntp > 192.168.X.255.ntp: NTPv4, Broadcast, length 48

28 packets captured
28 packets received by filter
0 packets dropped by kernel
^C$
```

I use a separat WiFi network hosted on a pizero using hostapd and dnsmasq with the TP-Link TL-WN722N as AP- and Client-Interface.

**Comment by pinae** [comment]
That looks exactly like the buttons I tested. 
@vanniktech Could you post a tcpdump of the packets your Somat-button sends.

**Comment by vanniktech** [comment]
When running `sudo tcpdump -i wlan0` on my PI I don't get any output data containing the MAC address of the button. Is this expected? However if I run the `listen.py` script the 'Button pressed' is still printed to the console.

**Comment by vanniktech** [comment]
Okay weird I think my Somat Dash Button is damaged. The same script runs perfectly fine with the Persil one but not with the Somat Button. The Somat button is just keep on sending presses 24/7.

**Comment by pinae** [comment]
I just tested a brand new Persil-Button and it behaved exactly as I expected. I do not think that there is a new hardware revision or firmware.

Maybe you could return your Somat-Button to Amazon. Let me know if they say something interesting when you do that.

**Comment by vanniktech** [comment]
Ended up not using the script on the Somat button (most likely damaged from shipping). The script still works fine on all other buttons that I've got. Thanks again for all of your help & the script :)
